[
  {
    "id": "dailylife-0001",
    "word": "grocery",
    "displayWord": "Grocery",
    "phonetic": "/grocery/",
    "mean": "food supplies",
    "pos": "n.",
    "level": "core",
    "tags": ["daily-life", "shopping"],
    "example": "I picked up groceries after work.",
    "exampleZh": "",
    "synonyms": ["food items", "supplies"],
    "distractors": ["receipt", "reservation", "bill"],
    "source": "internal",
    "updatedAt": "2026-04-08"
  },
  {
    "id": "dailylife-0002",
    "word": "laundry",
    "displayWord": "Laundry",
    "phonetic": "/laundry/",
    "mean": "clothes to be washed",
    "pos": "n.",
    "level": "core",
    "tags": ["daily-life", "home"],
    "example": "The laundry is still in the basket.",
    "exampleZh": "",
    "synonyms": ["washing", "dirty clothes"],
    "distractors": ["detergent", "aisle", "grocery"],
    "source": "internal",
    "updatedAt": "2026-04-08"
  },
  {
    "id": "dailylife-0003",
    "word": "prescription",
    "displayWord": "Prescription",
    "phonetic": "/prescription/",
    "mean": "doctor order",
    "pos": "n.",
    "level": "core",
    "tags": ["daily-life", "health"],
    "example": "You need a prescription for this medicine.",
    "exampleZh": "",
    "synonyms": ["medical order", "doctor note"],
    "distractors": ["receipt", "bill", "discount"],
    "source": "internal",
    "updatedAt": "2026-04-08"
  },
  {
    "id": "dailylife-0004",
    "word": "aisle",
    "displayWord": "Aisle",
    "phonetic": "/aisle/",
    "mean": "walkway",
    "pos": "n.",
    "level": "core",
    "tags": ["daily-life", "shopping"],
    "example": "The cereal is in the next aisle.",
    "exampleZh": "",
    "synonyms": ["passage", "walkway"],
    "distractors": ["receipt", "neighbor", "reservation"],
    "source": "internal",
    "updatedAt": "2026-04-08"
  },
  {
    "id": "dailylife-0005",
    "word": "receipt",
    "displayWord": "Receipt",
    "phonetic": "/receipt/",
    "mean": "proof of purchase",
    "pos": "n.",
    "level": "core",
    "tags": ["daily-life", "shopping"],
    "example": "Keep the receipt in case you need a refund.",
    "exampleZh": "",
    "synonyms": ["sales slip", "proof"],
    "distractors": ["bill", "reservation", "discount"],
    "source": "internal",
    "updatedAt": "2026-04-08"
  },
  {
    "id": "dailylife-0006",
    "word": "commuter",
    "displayWord": "Commuter",
    "phonetic": "/commuter/",
    "mean": "person who travels to work",
    "pos": "n.",
    "level": "extended",
    "tags": ["daily-life", "transportation"],
    "example": "Morning commuters packed the station.",
    "exampleZh": "",
    "synonyms": ["traveler", "worker traveler"],
    "distractors": ["neighbor", "client", "discount"],
    "source": "internal",
    "updatedAt": "2026-04-08"
  },
  {
    "id": "dailylife-0007",
    "word": "detergent",
    "displayWord": "Detergent",
    "phonetic": "/detergent/",
    "mean": "cleaning agent",
    "pos": "n.",
    "level": "core",
    "tags": ["daily-life", "home"],
    "example": "Use gentle detergent for delicate clothes.",
    "exampleZh": "",
    "synonyms": ["cleaner", "soap"],
    "distractors": ["laundry", "discount", "receipt"],
    "source": "internal",
    "updatedAt": "2026-04-08"
  },
  {
    "id": "dailylife-0008",
    "word": "reservation",
    "displayWord": "Reservation",
    "phonetic": "/reservation/",
    "mean": "booking",
    "pos": "n.",
    "level": "core",
    "tags": ["daily-life", "service"],
    "example": "She made a dinner reservation online.",
    "exampleZh": "",
    "synonyms": ["booking", "appointment"],
    "distractors": ["bill", "aisle", "grocery"],
    "source": "internal",
    "updatedAt": "2026-04-08"
  },
  {
    "id": "dailylife-0009",
    "word": "discount",
    "displayWord": "Discount",
    "phonetic": "/discount/",
    "mean": "price reduction",
    "pos": "n.",
    "level": "core",
    "tags": ["daily-life", "shopping"],
    "example": "Students get a discount at this store.",
    "exampleZh": "",
    "synonyms": ["reduction", "sale price"],
    "distractors": ["bill", "receipt", "aisle"],
    "source": "internal",
    "updatedAt": "2026-04-08"
  },
  {
    "id": "dailylife-0010",
    "word": "convenient",
    "displayWord": "Convenient",
    "phonetic": "/convenient/",
    "mean": "easy to use",
    "pos": "adj.",
    "level": "core",
    "tags": ["daily-life", "description"],
    "example": "Online payment is very convenient.",
    "exampleZh": "",
    "synonyms": ["handy", "practical"],
    "distractors": ["formal", "reliable", "patient"],
    "source": "internal",
    "updatedAt": "2026-04-08"
  },
  {
    "id": "dailylife-0011",
    "word": "neighbor",
    "displayWord": "Neighbor",
    "phonetic": "/neighbor/",
    "mean": "person living nearby",
    "pos": "n.",
    "level": "core",
    "tags": ["daily-life", "community"],
    "example": "Our neighbor helped carry the boxes.",
    "exampleZh": "",
    "synonyms": ["nearby resident", "local resident"],
    "distractors": ["receipt", "detergent", "prescription"],
    "source": "internal",
    "updatedAt": "2026-04-08"
  },
  {
    "id": "dailylife-0012",
    "word": "recommend",
    "displayWord": "Recommend",
    "phonetic": "/recommend/",
    "mean": "suggest",
    "pos": "v.",
    "level": "core",
    "tags": ["daily-life", "conversation"],
    "example": "Can you recommend a good restaurant nearby?",
    "exampleZh": "",
    "synonyms": ["suggest", "endorse"],
    "distractors": ["submit", "arrange", "repair"],
    "source": "internal",
    "updatedAt": "2026-04-08"
  },
  {
    "id": "dailylife-0013",
    "word": "bill",
    "displayWord": "Bill",
    "phonetic": "/bill/",
    "mean": "invoice",
    "pos": "n.",
    "level": "core",
    "tags": ["daily-life", "finance"],
    "example": "The phone bill arrived this morning.",
    "exampleZh": "",
    "synonyms": ["invoice", "statement"],
    "distractors": ["receipt", "reservation", "prescription"],
    "source": "internal",
    "updatedAt": "2026-04-08"
  },
  {
    "id": "dailylife-0014",
    "word": "repair",
    "displayWord": "Repair",
    "phonetic": "/repair/",
    "mean": "fix",
    "pos": "v.",
    "level": "extended",
    "tags": ["daily-life", "service"],
    "example": "The shop can repair your phone today.",
    "exampleZh": "",
    "synonyms": ["fix", "mend"],
    "distractors": ["recommend", "confirm", "compare"],
    "source": "internal",
    "updatedAt": "2026-04-08"
  },
  {
    "id": "dailylife-0015",
    "word": "crowded",
    "displayWord": "Crowded",
    "phonetic": "/crowded/",
    "mean": "full of people",
    "pos": "adj.",
    "level": "extended",
    "tags": ["daily-life", "description"],
    "example": "The night market gets crowded after sunset.",
    "exampleZh": "",
    "synonyms": ["packed", "busy"],
    "distractors": ["formal", "reliable", "convenient"],
    "source": "internal",
    "updatedAt": "2026-04-08"
  }
]
