[
  {
    "id": "toeic-0001",
    "word": "implement",
    "displayWord": "Implement",
    "phonetic": "/implement/",
    "mean": "carry out",
    "pos": "v.",
    "level": "core",
    "tags": ["business", "operations"],
    "example": "We need to implement the new policy next month.",
    "exampleZh": "我們需要在下個月實施新政策。",
    "synonyms": ["execute", "apply"],
    "distractors": ["delay", "maintain", "confirm"],
    "source": "internal",
    "updatedAt": "2026-04-08"
  },
  {
    "id": "toeic-0002",
    "word": "revenue",
    "displayWord": "Revenue",
    "phonetic": "/revenue/",
    "mean": "income",
    "pos": "n.",
    "level": "core",
    "tags": ["business", "finance"],
    "example": "Revenue increased after the product launch.",
    "exampleZh": "產品上市後，營收增加了。",
    "synonyms": ["income", "earnings"],
    "distractors": ["budget", "contract", "client"],
    "source": "internal",
    "updatedAt": "2026-04-08"
  },
  {
    "id": "toeic-0003",
    "word": "commute",
    "displayWord": "Commute",
    "phonetic": "/commute/",
    "mean": "travel to work",
    "pos": "v.",
    "level": "core",
    "tags": ["business", "transportation"],
    "example": "She commutes by train every weekday.",
    "exampleZh": "她每個平日都搭火車通勤。",
    "synonyms": ["travel", "ride in"],
    "distractors": ["submit", "repair", "compare"],
    "source": "internal",
    "updatedAt": "2026-04-08"
  },
  {
    "id": "toeic-0004",
    "word": "negotiate",
    "displayWord": "Negotiate",
    "phonetic": "/negotiate/",
    "mean": "discuss terms",
    "pos": "v.",
    "level": "core",
    "tags": ["business", "sales"],
    "example": "They negotiated a lower shipping fee.",
    "exampleZh": "他們談到了更低的運費。",
    "synonyms": ["bargain", "discuss"],
    "distractors": ["implement", "maintain", "cancel"],
    "source": "internal",
    "updatedAt": "2026-04-08"
  },
  {
    "id": "toeic-0005",
    "word": "compensate",
    "displayWord": "Compensate",
    "phonetic": "/compensate/",
    "mean": "make up for",
    "pos": "v.",
    "level": "extended",
    "tags": ["business", "policy"],
    "example": "The airline will compensate affected passengers.",
    "exampleZh": "航空公司會補償受影響的旅客。",
    "synonyms": ["reimburse", "repay"],
    "distractors": ["recommend", "confirm", "compare"],
    "source": "internal",
    "updatedAt": "2026-04-08"
  },
  {
    "id": "toeic-0006",
    "word": "proposal",
    "displayWord": "Proposal",
    "phonetic": "/proposal/",
    "mean": "formal plan",
    "pos": "n.",
    "level": "core",
    "tags": ["business", "planning"],
    "example": "The board approved the proposal yesterday.",
    "exampleZh": "董事會昨天批准了這份提案。",
    "synonyms": ["plan", "suggestion"],
    "distractors": ["meeting", "schedule", "application"],
    "source": "internal",
    "updatedAt": "2026-04-08"
  },
  {
    "id": "toeic-0007",
    "word": "evaluate",
    "displayWord": "Evaluate",
    "phonetic": "/evaluate/",
    "mean": "assess",
    "pos": "v.",
    "level": "core",
    "tags": ["business", "analysis"],
    "example": "We need to evaluate the risks before investing.",
    "exampleZh": "投資之前我們需要評估風險。",
    "synonyms": ["assess", "judge"],
    "distractors": ["arrange", "repair", "delay"],
    "source": "internal",
    "updatedAt": "2026-04-08"
  },
  {
    "id": "toeic-0008",
    "word": "deadline",
    "displayWord": "Deadline",
    "phonetic": "/deadline/",
    "mean": "due date",
    "pos": "n.",
    "level": "core",
    "tags": ["business", "project-management"],
    "example": "The report deadline is Friday afternoon.",
    "exampleZh": "這份報告的截止日是週五下午。",
    "synonyms": ["time limit", "due date"],
    "distractors": ["reward", "equipment", "cargo"],
    "source": "internal",
    "updatedAt": "2026-04-08"
  },
  {
    "id": "toeic-0009",
    "word": "maintain",
    "displayWord": "Maintain",
    "phonetic": "/maintain/",
    "mean": "keep in good condition",
    "pos": "v.",
    "level": "extended",
    "tags": ["business", "operations"],
    "example": "It is important to maintain customer trust.",
    "exampleZh": "維持客戶信任是很重要的。",
    "synonyms": ["preserve", "sustain"],
    "distractors": ["cancel", "repair", "compare"],
    "source": "internal",
    "updatedAt": "2026-04-08"
  },
  {
    "id": "toeic-0010",
    "word": "schedule",
    "displayWord": "Schedule",
    "phonetic": "/schedule/",
    "mean": "timetable",
    "pos": "n.",
    "level": "core",
    "tags": ["business", "planning"],
    "example": "Please review tomorrow's meeting schedule.",
    "exampleZh": "請查看明天的會議時程。",
    "synonyms": ["agenda", "timetable"],
    "distractors": ["department", "equipment", "discount"],
    "source": "internal",
    "updatedAt": "2026-04-08"
  },
  {
    "id": "toeic-0011",
    "word": "client",
    "displayWord": "Client",
    "phonetic": "/client/",
    "mean": "customer",
    "pos": "n.",
    "level": "core",
    "tags": ["business", "sales"],
    "example": "The client requested a revised draft.",
    "exampleZh": "客戶要求一份修訂後的草稿。",
    "synonyms": ["customer", "buyer"],
    "distractors": ["budget", "contract", "department"],
    "source": "internal",
    "updatedAt": "2026-04-08"
  },
  {
    "id": "toeic-0012",
    "word": "efficient",
    "displayWord": "Efficient",
    "phonetic": "/efficient/",
    "mean": "productive",
    "pos": "adj.",
    "level": "core",
    "tags": ["business", "performance"],
    "example": "She designed a more efficient workflow.",
    "exampleZh": "她設計了一套更有效率的工作流程。",
    "synonyms": ["effective", "productive"],
    "distractors": ["formal", "reliable", "patient"],
    "source": "internal",
    "updatedAt": "2026-04-08"
  },
  {
    "id": "toeic-0013",
    "word": "budget",
    "displayWord": "Budget",
    "phonetic": "/budget/",
    "mean": "spending plan",
    "pos": "n.",
    "level": "core",
    "tags": ["business", "finance"],
    "example": "The marketing budget was reduced this year.",
    "exampleZh": "今年的行銷預算被削減了。",
    "synonyms": ["plan", "allowance"],
    "distractors": ["receipt", "meeting", "contract"],
    "source": "internal",
    "updatedAt": "2026-04-08"
  },
  {
    "id": "toeic-0014",
    "word": "submit",
    "displayWord": "Submit",
    "phonetic": "/submit/",
    "mean": "hand in",
    "pos": "v.",
    "level": "core",
    "tags": ["business", "workflow"],
    "example": "Please submit the expense report by noon.",
    "exampleZh": "請在中午前提交報帳報告。",
    "synonyms": ["send", "present"],
    "distractors": ["repair", "delay", "recommend"],
    "source": "internal",
    "updatedAt": "2026-04-08"
  },
  {
    "id": "toeic-0015",
    "word": "contract",
    "displayWord": "Contract",
    "phonetic": "/contract/",
    "mean": "agreement",
    "pos": "n.",
    "level": "core",
    "tags": ["business", "legal"],
    "example": "They signed the contract on Monday.",
    "exampleZh": "他們在週一簽了這份合約。",
    "synonyms": ["agreement", "deal"],
    "distractors": ["budget", "proposal", "client"],
    "source": "internal",
    "updatedAt": "2026-04-08"
  }
]
