[
  {
    "id": "school7000-0001",
    "word": "ephemeral",
    "displayWord": "Ephemeral",
    "phonetic": "/ephemeral/",
    "mean": "short-lived",
    "pos": "adj.",
    "level": "core",
    "tags": ["academic", "reading"],
    "example": "Trends on social media can be ephemeral.",
    "exampleZh": "社群媒體上的趨勢可能只是曇花一現。",
    "synonyms": ["brief", "temporary"],
    "distractors": ["formal", "reliable", "patient"],
    "source": "internal",
    "updatedAt": "2026-04-08"
  },
  {
    "id": "school7000-0002",
    "word": "ubiquitous",
    "displayWord": "Ubiquitous",
    "phonetic": "/ubiquitous/",
    "mean": "found everywhere",
    "pos": "adj.",
    "level": "core",
    "tags": ["academic", "reading"],
    "example": "Smartphones are ubiquitous in modern life.",
    "exampleZh": "智慧型手機在現代生活中無所不在。",
    "synonyms": ["widespread", "omnipresent"],
    "distractors": ["formal", "patient", "reliable"],
    "source": "internal",
    "updatedAt": "2026-04-08"
  },
  {
    "id": "school7000-0003",
    "word": "resilient",
    "displayWord": "Resilient",
    "phonetic": "/resilient/",
    "mean": "able to recover",
    "pos": "adj.",
    "level": "core",
    "tags": ["academic", "character"],
    "example": "Young children are often resilient after setbacks.",
    "exampleZh": "年幼的孩子在挫折之後往往很有韌性。",
    "synonyms": ["tough", "adaptable"],
    "distractors": ["formal", "accurate", "crowded"],
    "source": "internal",
    "updatedAt": "2026-04-08"
  },
  {
    "id": "school7000-0004",
    "word": "mitigate",
    "displayWord": "Mitigate",
    "phonetic": "/mitigate/",
    "mean": "make less severe",
    "pos": "v.",
    "level": "core",
    "tags": ["academic", "analysis"],
    "example": "Good planning can mitigate some risks.",
    "exampleZh": "良好的規劃可以減輕某些風險。",
    "synonyms": ["reduce", "ease"],
    "distractors": ["submit", "repair", "compare"],
    "source": "internal",
    "updatedAt": "2026-04-08"
  },
  {
    "id": "school7000-0005",
    "word": "ambiguous",
    "displayWord": "Ambiguous",
    "phonetic": "/ambiguous/",
    "mean": "unclear",
    "pos": "adj.",
    "level": "core",
    "tags": ["academic", "writing"],
    "example": "His answer was too ambiguous to grade easily.",
    "exampleZh": "他的答案太模糊，不容易評分。",
    "synonyms": ["vague", "uncertain"],
    "distractors": ["formal", "reliable", "efficient"],
    "source": "internal",
    "updatedAt": "2026-04-08"
  },
  {
    "id": "school7000-0006",
    "word": "inevitable",
    "displayWord": "Inevitable",
    "phonetic": "/inevitable/",
    "mean": "certain to happen",
    "pos": "adj.",
    "level": "core",
    "tags": ["academic", "logic"],
    "example": "Some changes are inevitable over time.",
    "exampleZh": "有些改變隨著時間推移是不可避免的。",
    "synonyms": ["unavoidable", "certain"],
    "distractors": ["reliable", "patient", "convenient"],
    "source": "internal",
    "updatedAt": "2026-04-08"
  },
  {
    "id": "school7000-0007",
    "word": "plausible",
    "displayWord": "Plausible",
    "phonetic": "/plausible/",
    "mean": "seemingly reasonable",
    "pos": "adj.",
    "level": "core",
    "tags": ["academic", "logic"],
    "example": "Her explanation sounded plausible at first.",
    "exampleZh": "她的解釋一開始聽起來似乎很合理。",
    "synonyms": ["believable", "credible"],
    "distractors": ["formal", "patient", "crowded"],
    "source": "internal",
    "updatedAt": "2026-04-08"
  },
  {
    "id": "school7000-0008",
    "word": "convey",
    "displayWord": "Convey",
    "phonetic": "/convey/",
    "mean": "communicate",
    "pos": "v.",
    "level": "extended",
    "tags": ["academic", "writing"],
    "example": "The essay conveys a clear point of view.",
    "exampleZh": "這篇文章清楚傳達了觀點。",
    "synonyms": ["express", "deliver"],
    "distractors": ["confirm", "repair", "delay"],
    "source": "internal",
    "updatedAt": "2026-04-08"
  },
  {
    "id": "school7000-0009",
    "word": "abundant",
    "displayWord": "Abundant",
    "phonetic": "/abundant/",
    "mean": "more than enough",
    "pos": "adj.",
    "level": "extended",
    "tags": ["academic", "reading"],
    "example": "The region has abundant natural resources.",
    "exampleZh": "這個地區有豐富的自然資源。",
    "synonyms": ["plentiful", "ample"],
    "distractors": ["formal", "patient", "efficient"],
    "source": "internal",
    "updatedAt": "2026-04-08"
  },
  {
    "id": "school7000-0010",
    "word": "infer",
    "displayWord": "Infer",
    "phonetic": "/infer/",
    "mean": "draw a conclusion",
    "pos": "v.",
    "level": "core",
    "tags": ["academic", "reading"],
    "example": "Readers can infer the meaning from context.",
    "exampleZh": "讀者可以從上下文推論意思。",
    "synonyms": ["deduce", "conclude"],
    "distractors": ["submit", "compare", "cancel"],
    "source": "internal",
    "updatedAt": "2026-04-08"
  },
  {
    "id": "school7000-0011",
    "word": "durable",
    "displayWord": "Durable",
    "phonetic": "/durable/",
    "mean": "long-lasting",
    "pos": "adj.",
    "level": "extended",
    "tags": ["academic", "description"],
    "example": "This material is both light and durable.",
    "exampleZh": "這種材料既輕巧又耐用。",
    "synonyms": ["sturdy", "lasting"],
    "distractors": ["crowded", "formal", "accurate"],
    "source": "internal",
    "updatedAt": "2026-04-08"
  },
  {
    "id": "school7000-0012",
    "word": "prestige",
    "displayWord": "Prestige",
    "phonetic": "/prestige/",
    "mean": "high status",
    "pos": "n.",
    "level": "extended",
    "tags": ["academic", "society"],
    "example": "The university has international prestige.",
    "exampleZh": "這所大學享有國際聲望。",
    "synonyms": ["status", "reputation"],
    "distractors": ["budget", "bill", "discount"],
    "source": "internal",
    "updatedAt": "2026-04-08"
  },
  {
    "id": "school7000-0013",
    "word": "compile",
    "displayWord": "Compile",
    "phonetic": "/compile/",
    "mean": "collect into one work",
    "pos": "v.",
    "level": "extended",
    "tags": ["academic", "writing"],
    "example": "She compiled the notes into a study guide.",
    "exampleZh": "她把筆記彙整成一份學習指南。",
    "synonyms": ["assemble", "gather"],
    "distractors": ["repair", "delay", "confirm"],
    "source": "internal",
    "updatedAt": "2026-04-08"
  },
  {
    "id": "school7000-0014",
    "word": "validate",
    "displayWord": "Validate",
    "phonetic": "/validate/",
    "mean": "confirm",
    "pos": "v.",
    "level": "extended",
    "tags": ["academic", "research"],
    "example": "The experiment helped validate the theory.",
    "exampleZh": "這項實驗幫助驗證了理論。",
    "synonyms": ["verify", "confirm"],
    "distractors": ["submit", "cancel", "repair"],
    "source": "internal",
    "updatedAt": "2026-04-08"
  },
  {
    "id": "school7000-0015",
    "word": "adjacent",
    "displayWord": "Adjacent",
    "phonetic": "/adjacent/",
    "mean": "next to",
    "pos": "adj.",
    "level": "extended",
    "tags": ["academic", "description"],
    "example": "The lab is adjacent to the library.",
    "exampleZh": "實驗室就在圖書館旁邊。",
    "synonyms": ["nearby", "neighboring"],
    "distractors": ["temporary", "accurate", "formal"],
    "source": "internal",
    "updatedAt": "2026-04-08"
  }
]
